<?xml version='1.0' encoding='utf-8'?>
<S2OPC xmlns:xsi="http://www.w3.org/2001/XMLSchema-instance" xsi:noNamespaceSchemaLocation="s2opc_clientserver_config.xsd">
  <ServerConfiguration>
    <Namespaces>
      <Namespace uri="urn:S2OPC:localhost"/>
    </Namespaces>
    <Locales>
      <Locale id="en-US"/>
      <Locale id="fr-FR"/>
    </Locales>
    <ApplicationCertificates>
      <ServerCertificate path="server_public/server_4k_cert.der"/>
      <ServerKey path="server_private/encrypted_server_4k_key.pem" encrypted="true"/>
      <TrustedIssuers>
        <!-- List of trusted CAs for which issued certificates are trusted -->
        <TrustedIssuer root="true" cert_path="trusted/cacert.der" revocation_list_path="revoked/cacrl.der"/>
      </TrustedIssuers>
      <!-- or/and <IssuedCertificates> if trusted issued certificates (self-signed or from known untrusted issuer) -->
      <!-- with <UntrustedIssuers> for untrusted issuers -->
    </ApplicationCertificates>
    <ApplicationDescription>
      <ApplicationURI uri="urn:S2OPC:localhost"/>
      <ProductURI uri="urn:S2OPC:localhost"/>
      <ApplicationName text="S2OPC toolkit server security target example" locale="en-US"/>
      <ApplicationName text="S2OPC toolkit: exemple de cible de sécurité serveur" locale="fr-FR"/>
      <!-- No discovery URL: use of endpoint URL as discovery URL -->
    </ApplicationDescription>
    <Endpoints>
      <Endpoint url="opc.tcp://localhost:4841">
        <SecurityPolicies>
          <SecurityPolicy uri="http://opcfoundation.org/UA/SecurityPolicy#Basic256Sha256">
            <SecurityModes>
              <SecurityMode mode="Sign"/>
              <SecurityMode mode="SignAndEncrypt"/>
            </SecurityModes>
            <UserPolicies>
              <UserPolicy policyId="user" tokenType="username" securityUri="http://opcfoundation.org/UA/SecurityPolicy#Basic256Sha256"/>
            </UserPolicies>
          </SecurityPolicy>
        </SecurityPolicies>
      </Endpoint>
    </Endpoints>
  </ServerConfiguration>
</S2OPC>
