<?xml version='1.0' encoding='utf-8'?>
<S2OPC xmlns:xsi="http://www.w3.org/2001/XMLSchema-instance" xsi:noNamespaceSchemaLocation="s2opc_clientserver_config.xsd">
  <ServerConfiguration>
    <Locales>
      <Locale id="en-US"/>
      <Locale id="fr-FR"/>
    </Locales>
    <ApplicationCertificates>
      <ServerCertificate path="server_public/server_4k_cert.der"/>
      <ServerKey path="server_private/encrypted_server_4k_key.pem" encrypted="true"/>
      <ServerPublicKeyInfrastructure path="./S2OPC_Demo_PKI"/>
    </ApplicationCertificates>
    <ApplicationDescription>
      <ApplicationURI uri="urn:S2OPC:localhost"/>
      <ProductURI uri="urn:S2OPC:localhost:product"/>
      <ApplicationName text="S2OPC toolkit server example" locale="en-US"/>
      <ApplicationName text="S2OPC toolkit: exemple de serveur" locale="fr-FR"/>
      <!-- No discovery URL: use of endpoint URL as discovery URL -->
    </ApplicationDescription>
    <Endpoints>
      <!-- Note: Endpoint no transport URI (only TCP available) and no security level (computed by server) -->
      <Endpoint url="opc.tcp://localhost:4841">
        <SecurityPolicies>
          <SecurityPolicy uri="http://opcfoundation.org/UA/SecurityPolicy#Basic256Sha256">
            <SecurityModes>
              <SecurityMode mode="Sign"/>
            </SecurityModes>
            <UserPolicies>
              <!-- Available token types are only anonymous and username. Security URI is Basic256Sha256 to encrypt password since secure channel is not encrypted -->
              <UserPolicy policyId="anon" tokenType="anonymous"/>
              <UserPolicy policyId="username_Basic256Sha256" tokenType="username" securityUri="http://opcfoundation.org/UA/SecurityPolicy#Basic256Sha256"/>
              <UserPolicy policyId="X509_Basic256Sha256" tokenType="certificate" securityUri="http://opcfoundation.org/UA/SecurityPolicy#Basic256Sha256"/>
            </UserPolicies>
          </SecurityPolicy>
          <SecurityPolicy uri="http://opcfoundation.org/UA/SecurityPolicy#Basic256Sha256">
            <SecurityModes>
              <SecurityMode mode="SignAndEncrypt"/>
            </SecurityModes>
            <UserPolicies>
              <!-- Available token types are only anonymous and username. Security URI set is None which is secure since secure channel is already encrypted -->
              <UserPolicy policyId="anon" tokenType="anonymous"/>
              <UserPolicy policyId="user" tokenType="username" securityUri="http://opcfoundation.org/UA/SecurityPolicy#None"/>
              <UserPolicy policyId="X509_Basic256Sha256" tokenType="certificate" securityUri="http://opcfoundation.org/UA/SecurityPolicy#Basic256Sha256"/>
            </UserPolicies>
          </SecurityPolicy>
          <SecurityPolicy uri="http://opcfoundation.org/UA/SecurityPolicy#Aes128_Sha256_RsaOaep">
            <SecurityModes>
              <SecurityMode mode="Sign"/>
              <SecurityMode mode="SignAndEncrypt"/>
            </SecurityModes>
            <UserPolicies>
              <UserPolicy policyId="anon" tokenType="anonymous"/>
              <UserPolicy policyId="username_RsaOep" tokenType="username" securityUri="http://opcfoundation.org/UA/SecurityPolicy#Aes128_Sha256_RsaOaep"/>
              <UserPolicy policyId="X509_Basic256Sha256" tokenType="certificate" securityUri="http://opcfoundation.org/UA/SecurityPolicy#Basic256Sha256"/>
            </UserPolicies>
          </SecurityPolicy>
          <SecurityPolicy uri="http://opcfoundation.org/UA/SecurityPolicy#Aes256_Sha256_RsaPss">
            <SecurityModes>
              <SecurityMode mode="Sign"/>
              <SecurityMode mode="SignAndEncrypt"/>
            </SecurityModes>
            <UserPolicies>
              <UserPolicy policyId="anon" tokenType="anonymous"/>
              <UserPolicy policyId="username_RsaPss" tokenType="username" securityUri="http://opcfoundation.org/UA/SecurityPolicy#Aes256_Sha256_RsaPss"/>
              <UserPolicy policyId="X509_Basic256Sha256" tokenType="certificate" securityUri="http://opcfoundation.org/UA/SecurityPolicy#Basic256Sha256"/>
            </UserPolicies>
          </SecurityPolicy>
        </SecurityPolicies>
      </Endpoint>
    </Endpoints>
  </ServerConfiguration>
</S2OPC>
