<?xml version='1.0' encoding='utf-8'?>
<S2OPC xmlns:xsi="http://www.w3.org/2001/XMLSchema-instance" xsi:noNamespaceSchemaLocation="s2opc_clientserver_config.xsd">
  <ServerConfiguration>
    <Locales>
      <Locale id="en-US"/>
      <Locale id="fr-FR"/>
    </Locales>
    <ApplicationDescription>
      <ApplicationURI uri="urn:S2OPC:localhost"/>
      <ProductURI uri="urn:S2OPC:localhost:product"/>
      <ApplicationName text="S2OPC toolkit server used for fuzzing" locale="en-US"/>
      <ApplicationName text="S2OPC toolkit: serveur pour le fuzzing" locale="fr-FR"/>
      <!-- No discovery URL: use of endpoint URL as discovery URL -->
    </ApplicationDescription>
    <Endpoints>
      <!-- Available token types are only anonymous. Security URI is None -->
      <Endpoint url="opc.tcp://localhost:4841">
        <SecurityPolicies>
          <SecurityPolicy uri="http://opcfoundation.org/UA/SecurityPolicy#None">
            <SecurityModes>
              <SecurityMode mode="None"/>
            </SecurityModes>
            <UserPolicies>
              <UserPolicy policyId="anon" tokenType="anonymous"/>
            </UserPolicies>
          </SecurityPolicy>
        </SecurityPolicies>
      </Endpoint>
    </Endpoints>
  </ServerConfiguration>
</S2OPC>
