<?xml version='1.0' encoding='utf-8'?>
<S2OPC xmlns:xsi="http://www.w3.org/2001/XMLSchema-instance" xsi:noNamespaceSchemaLocation="s2opc_clientserver_config.xsd">
  <ServerConfiguration>
    <Locales>
      <Locale id="en-US"/>
      <Locale id="fr-FR"/>
    </Locales>
    <ApplicationCertificates>
      <ServerCertificate path="./server_public/server_2k_cert.der"/>
      <ServerKey path="./server_private/encrypted_server_2k_key.pem" encrypted="true"/>
      <ServerPublicKeyInfrastructure path="./S2OPC_UACTT_PKI"/>
    </ApplicationCertificates>
    <ApplicationDescription>
      <ApplicationURI uri="urn:S2OPC:localhost"/>
      <ProductURI uri="urn:S2OPC:localhost:product"/>
      <ApplicationName text="S2OPC toolkit server example" locale="en-US"/>
      <ApplicationName text="S2OPC toolkit: exemple de serveur" locale="fr-FR"/>
      <ApplicationType type="Server"/>
    </ApplicationDescription>
    <Endpoints>
      <Endpoint url="opc.tcp://localhost:4841" enableListening="true">
        <ReverseConnections>
          <ReverseConnection clientAppUri="urn:S2OPC:client" clientUrl="opc.tcp://localhost:4844"/>
        </ReverseConnections>
        <SecurityPolicies>
          <SecurityPolicy uri="http://opcfoundation.org/UA/SecurityPolicy#Basic256Sha256">
            <SecurityModes>
              <SecurityMode mode="Sign"/>
              <SecurityMode mode="SignAndEncrypt"/>
            </SecurityModes>
            <UserPolicies>
              <UserPolicy policyId="anonymous" tokenType="anonymous"/>
              <UserPolicy policyId="username_Basic256Sha256" tokenType="username" securityUri="http://opcfoundation.org/UA/SecurityPolicy#Basic256Sha256"/>
              <UserPolicy policyId="X509" tokenType="certificate" securityUri=""/>
            </UserPolicies>
          </SecurityPolicy>
          <SecurityPolicy uri="http://opcfoundation.org/UA/SecurityPolicy#Basic256">
            <SecurityModes>
              <SecurityMode mode="Sign"/>
              <SecurityMode mode="SignAndEncrypt"/>
            </SecurityModes>
            <UserPolicies>
              <UserPolicy policyId="anonymous" tokenType="anonymous"/>
              <UserPolicy policyId="username_Basic256Sha256" tokenType="username" securityUri="http://opcfoundation.org/UA/SecurityPolicy#Basic256Sha256"/>
              <UserPolicy policyId="X509" tokenType="certificate" securityUri=""/>
            </UserPolicies>
          </SecurityPolicy>
          <SecurityPolicy uri="http://opcfoundation.org/UA/SecurityPolicy#Aes128_Sha256_RsaOaep">
            <SecurityModes>
              <SecurityMode mode="Sign"/>
              <SecurityMode mode="SignAndEncrypt"/>
            </SecurityModes>
            <UserPolicies>
              <UserPolicy policyId="anonymous" tokenType="anonymous"/>
              <UserPolicy policyId="username_Basic256Sha256" tokenType="username" securityUri="http://opcfoundation.org/UA/SecurityPolicy#Basic256Sha256"/>
              <UserPolicy policyId="X509" tokenType="certificate" securityUri=""/>
            </UserPolicies>
          </SecurityPolicy>
          <SecurityPolicy uri="http://opcfoundation.org/UA/SecurityPolicy#Aes256_Sha256_RsaPss">
            <SecurityModes>
              <SecurityMode mode="Sign"/>
              <SecurityMode mode="SignAndEncrypt"/>
            </SecurityModes>
            <UserPolicies>
              <UserPolicy policyId="anonymous" tokenType="anonymous"/>
              <UserPolicy policyId="username_Basic256Sha256" tokenType="username" securityUri="http://opcfoundation.org/UA/SecurityPolicy#Basic256Sha256"/>
              <UserPolicy policyId="X509" tokenType="certificate" securityUri=""/>
            </UserPolicies>
          </SecurityPolicy>
          <SecurityPolicy uri="http://opcfoundation.org/UA/SecurityPolicy#None">
            <SecurityModes>
              <SecurityMode mode="None"/>
            </SecurityModes>
            <UserPolicies>
              <UserPolicy policyId="anonymous" tokenType="anonymous"/>
              <UserPolicy policyId="username_Basic256Sha256" tokenType="username" securityUri="http://opcfoundation.org/UA/SecurityPolicy#Basic256Sha256"/>
              <UserPolicy policyId="X509_Basic256Sha256" tokenType="certificate" securityUri="http://opcfoundation.org/UA/SecurityPolicy#Basic256Sha256"/>
            </UserPolicies>
          </SecurityPolicy>
        </SecurityPolicies>
      </Endpoint>
    </Endpoints>
  </ServerConfiguration>
</S2OPC>
